{
  "schema_version": 1,
  "snapshot_id": "graph:rf-osr-pilot:2108.13099v1:v1",
  "created_at": "2026-09-30T12:30:00-04:00",
  "source_runs": [
    "extract:2108.13099v1:fulltext-layout:v1"
  ],
  "nodes": [
    {
      "id": "work:arxiv:2108.13099",
      "node_type": "Work",
      "record_ref": "work:arxiv:2108.13099",
      "verification_state": "MACHINE_CHECKED",
      "attributes": {
        "title": "Open Set RF Fingerprinting using Generative Outlier Augmentation"
      }
    },
    {
      "id": "work-version:arxiv:2108.13099v1",
      "node_type": "WorkVersion",
      "record_ref": "work-version:arxiv:2108.13099v1",
      "verification_state": "MACHINE_CHECKED",
      "attributes": {
        "arxiv": "2108.13099v1"
      }
    },
    {
      "id": "source-artifact:sha256:7fcfc9929fd80a94095657ebf644be3301000d0a4342b74de1adc2af529ff7ab",
      "node_type": "SourceArtifact",
      "record_ref": "source-artifact:sha256:7fcfc9929fd80a94095657ebf644be3301000d0a4342b74de1adc2af529ff7ab",
      "verification_state": "MACHINE_CHECKED",
      "attributes": {
        "sha256": "7fcfc9929fd80a94095657ebf644be3301000d0a4342b74de1adc2af529ff7ab",
        "byte_length": 816786
      }
    },
    {
      "id": "loc:p2:b12",
      "node_type": "SourceLocator",
      "record_ref": "loc:p2:b12",
      "verification_state": "MACHINE_CHECKED",
      "attributes": {
        "page": 2,
        "bbox": [
          48.96,
          527.15,
          300.03,
          656.66
        ],
        "section_path": [
          "II. SYSTEM MODEL AND PROBLEM FORMULATION"
        ],
        "quality": "EXACT"
      }
    },
    {
      "id": "loc:p2:b23",
      "node_type": "SourceLocator",
      "record_ref": "loc:p2:b23",
      "verification_state": "MACHINE_CHECKED",
      "attributes": {
        "page": 2,
        "bbox": [
          311.98,
          437.27,
          563.04,
          602.58
        ],
        "section_path": [
          "III. DATASET AND EVALUATION METHOD",
          "A. Dataset"
        ],
        "quality": "EXACT"
      }
    },
    {
      "id": "loc:p3:b0",
      "node_type": "SourceLocator",
      "record_ref": "loc:p3:b0",
      "verification_state": "MACHINE_CHECKED",
      "attributes": {
        "page": 3,
        "bbox": [
          48.96,
          51.84,
          300.03,
          217.58
        ],
        "section_path": [
          "III. DATASET AND EVALUATION METHOD",
          "B. Outlier detector architecture and evaluation"
        ],
        "quality": "EXACT"
      }
    },
    {
      "id": "loc:p3:b2",
      "node_type": "SourceLocator",
      "record_ref": "loc:p3:b2",
      "verification_state": "MACHINE_CHECKED",
      "attributes": {
        "page": 3,
        "bbox": [
          48.96,
          243.17,
          300.03,
          719.57
        ],
        "section_path": [
          "IV. SUPERVISED OUTLIER GENERATION"
        ],
        "quality": "EXACT"
      }
    },
    {
      "id": "loc:p3:b5",
      "node_type": "SourceLocator",
      "record_ref": "loc:p3:b5",
      "verification_state": "MACHINE_CHECKED",
      "attributes": {
        "page": 3,
        "bbox": [
          311.98,
          361.85,
          563.04,
          719.57
        ],
        "section_path": [
          "IV. SUPERVISED OUTLIER GENERATION"
        ],
        "quality": "EXACT"
      }
    },
    {
      "id": "loc:p4:b21",
      "node_type": "SourceLocator",
      "record_ref": "loc:p4:b21",
      "verification_state": "MACHINE_CHECKED",
      "attributes": {
        "page": 4,
        "bbox": [
          48.96,
          519.04,
          300.02,
          600.73
        ],
        "section_path": [
          "V. BLIND OUTLIER GENERATION"
        ],
        "quality": "EXACT"
      }
    },
    {
      "id": "loc:p4:b23",
      "node_type": "SourceLocator",
      "record_ref": "loc:p4:b23",
      "verification_state": "MACHINE_CHECKED",
      "attributes": {
        "page": 4,
        "bbox": [
          48.96,
          625.93,
          300.03,
          719.57
        ],
        "section_path": [
          "V. BLIND OUTLIER GENERATION",
          "A. Ellipsoisal method"
        ],
        "quality": "EXACT"
      }
    },
    {
      "id": "loc:p4:b50",
      "node_type": "SourceLocator",
      "record_ref": "loc:p4:b50",
      "verification_state": "MACHINE_CHECKED",
      "attributes": {
        "page": 4,
        "bbox": [
          311.98,
          503.3,
          563.04,
          719.57
        ],
        "section_path": [
          "V. BLIND OUTLIER GENERATION",
          "A. Ellipsoisal method"
        ],
        "quality": "EXACT"
      }
    },
    {
      "id": "loc:p5:b0",
      "node_type": "SourceLocator",
      "record_ref": "loc:p5:b0",
      "verification_state": "MACHINE_CHECKED",
      "attributes": {
        "page": 5,
        "bbox": [
          48.96,
          51.66,
          300.03,
          193.68
        ],
        "section_path": [
          "V. BLIND OUTLIER GENERATION",
          "A. Ellipsoisal method"
        ],
        "quality": "EXACT"
      }
    },
    {
      "id": "loc:p5:b6",
      "node_type": "SourceLocator",
      "record_ref": "loc:p5:b6",
      "verification_state": "MACHINE_CHECKED",
      "attributes": {
        "page": 5,
        "bbox": [
          48.96,
          352.25,
          300.03,
          613.27
        ],
        "section_path": [
          "V. BLIND OUTLIER GENERATION",
          "A. Ellipsoisal method"
        ],
        "quality": "EXACT"
      }
    },
    {
      "id": "loc:p5:b8",
      "node_type": "SourceLocator",
      "record_ref": "loc:p5:b8",
      "verification_state": "MACHINE_CHECKED",
      "attributes": {
        "page": 5,
        "bbox": [
          48.96,
          637.9,
          300.03,
          719.57
        ],
        "section_path": [
          "V. BLIND OUTLIER GENERATION",
          "B. Optimization method"
        ],
        "quality": "EXACT"
      }
    },
    {
      "id": "loc:p5:b25",
      "node_type": "SourceLocator",
      "record_ref": "loc:p5:b25",
      "verification_state": "MACHINE_CHECKED",
      "attributes": {
        "page": 5,
        "bbox": [
          311.98,
          406.99,
          563.04,
          584.67
        ],
        "section_path": [
          "V. BLIND OUTLIER GENERATION",
          "B. Optimization method"
        ],
        "quality": "EXACT"
      }
    },
    {
      "id": "loc:p5:b27",
      "node_type": "SourceLocator",
      "record_ref": "loc:p5:b27",
      "verification_state": "MACHINE_CHECKED",
      "attributes": {
        "page": 5,
        "bbox": [
          311.98,
          611.79,
          563.04,
          719.57
        ],
        "section_path": [
          "V. BLIND OUTLIER GENERATION",
          "B. Optimization method"
        ],
        "quality": "EXACT"
      }
    },
    {
      "id": "loc:p6:b20",
      "node_type": "SourceLocator",
      "record_ref": "loc:p6:b20",
      "verification_state": "MACHINE_CHECKED",
      "attributes": {
        "page": 6,
        "bbox": [
          48.96,
          446.75,
          300.03,
          719.57
        ],
        "section_path": [
          "V. BLIND OUTLIER GENERATION",
          "B. Optimization method"
        ],
        "quality": "EXACT"
      }
    },
    {
      "id": "loc:p6:b22",
      "node_type": "SourceLocator",
      "record_ref": "loc:p6:b22",
      "verification_state": "MACHINE_CHECKED",
      "attributes": {
        "page": 6,
        "bbox": [
          311.98,
          67.17,
          563.04,
          328.19
        ],
        "section_path": [
          "VI. CONCLUSION"
        ],
        "quality": "EXACT"
      }
    },
    {
      "id": "ev:2108:rq:1",
      "node_type": "RESEARCH_QUESTION",
      "record_ref": "ev:2108:rq:1",
      "verification_state": "MACHINE_CHECKED",
      "attributes": {
        "normalized_form": "Determine whether a received RF signal comes from an authorized transmitter and, when authorized, identify which transmitter sent it."
      }
    },
    {
      "id": "ev:2108:dataset:1",
      "node_type": "DATASET_OR_POPULATION",
      "record_ref": "ev:2108:dataset:1",
      "verification_state": "MACHINE_CHECKED",
      "attributes": {
        "normalized_form": "ORBIT WiFi testbed dataset using 71 transmitters and a USRP N210 receiver."
      }
    },
    {
      "id": "ev:2108:metric:1",
      "node_type": "METRIC",
      "record_ref": "ev:2108:metric:1",
      "verification_state": "MACHINE_CHECKED",
      "attributes": {
        "normalized_form": "Prediction accuracy of the OvA classifier on the held-out test set."
      }
    },
    {
      "id": "ev:2108:experiment:split",
      "node_type": "EXPERIMENT",
      "record_ref": "ev:2108:experiment:split",
      "verification_state": "MACHINE_CHECKED",
      "attributes": {
        "normalized_form": "Evaluation split uses 70% of authorized samples plus all known-outlier samples for train/validation, split 80/20; test contains all unknown-outlier samples plus remaining 30% of authorized samples."
      }
    },
    {
      "id": "ev:2108:method:vae",
      "node_type": "METHOD",
      "record_ref": "ev:2108:method:vae",
      "verification_state": "MACHINE_CHECKED",
      "attributes": {
        "normalized_form": "Supervised outlier generation trains a VAE on known unauthorized samples and uses its decoder to synthesize additional outliers."
      }
    },
    {
      "id": "ev:2108:experiment:vae",
      "node_type": "EXPERIMENT",
      "record_ref": "ev:2108:experiment:vae",
      "verification_state": "MACHINE_CHECKED",
      "attributes": {
        "normalized_form": "VAE experiment fixes 10 authorized transmitters, varies known unauthorized transmitters over 5/10/15/20/25, and augments training with 7,500 generated outlier samples."
      }
    },
    {
      "id": "ev:2108:method:cvae",
      "node_type": "METHOD",
      "record_ref": "ev:2108:method:cvae",